{"claimBoundary":{"doesNotImply":["time-root-fixture-does-not-prove-real-world-operator-identity","timestamp-signature-does-not-prove-clock-hardware-integrity","validity-window-does-not-imply-legal-or-business-effective-time","time-validation-does-not-imply-transparency-log-trust","time-validation-does-not-imply-global-append-only-consistency","time-validation-does-not-imply-content-revocation-or-withdrawal","p1-a11-does-not-imply-production-release-governance"]},"observations":[{"envelope":{"data":"0oRYXaMBJwN4NGFwcGxpY2F0aW9uL3ZuZC5laWdpaWIudHJ1c3RlZC10aW1lLW9ic2VydmF0aW9uK2pzb24EWCBA2njhblFqDSQYXMFnlnYAFfugiJuPu/4aSFTVZWkpMaBZAxN7ImF1dGhvcml0eUlkIjoiZWlnaWliLXAxLWExMS10c2EtMSIsIm9ic2VydmF0aW9uSWQiOiJiZWZvcmUtd2luZG93Iiwib2JzZXJ2YXRpb25TZXF1ZW5jZSI6MTAwLCJwb2xpY3lJZCI6ImVpZ2lpYi1wMS1hMTEtdGltZS1wb2xpY3ktMSIsInBvbGljeVNlcXVlbmNlIjoxLCJwdXJwb3NlIjoiZXZhbHVhdGUtcmVsZWFzZS1hdXRob3JpemF0aW9uLXZhbGlkaXR5Iiwic3RhbmRhcmQiOiJFSUdJSUItUDEtQTExLVRJTUUtT0JTRVJWQVRJT04tMS4wIiwic3ViamVjdCI6eyJhdXRob3JpemF0aW9uUmVwb3J0Ijp7ImFsZ29yaXRobSI6InNoYTI1NiIsImJ5dGVzIjoxOTc4LCJkaWdlc3QiOiIxODYyNjYyMGZjNjVkZDU5ZGI5NTZmOTI2YTkxOGRmZjAzZGQ3N2U1MzI0Zjg5ZDQzZGY1MzA0MzJlZjgwM2I3In0sInJlY292ZXJlZEF1dGhvcml6YXRpb25QYXlsb2FkIjp7ImFsZ29yaXRobSI6InNoYTI1NiIsImJ5dGVzIjo0NjksImRpZ2VzdCI6ImQxODUwNjA4NzdhYzlmNjNjZmIxYWU5M2YxYjU2YWVhMTYzMDdjZTA5MDk3N2JiYzNlOTk3MDM2YWU0YTVkMDEifSwicmVsZWFzZURlc2NyaXB0b3IiOnsiYWxnb3JpdGhtIjoic2hhMjU2IiwiYnl0ZXMiOjEyNzgsImRpZ2VzdCI6IjE1NTEwNTZkMGI5MDNmM2Y3NGIwYzQ4MzRjN2RkNjA3MjBlYTY1MWYzNjA4YzJlZTNlYTliMzAyYTJiOWY1ZWMifSwicmVsZWFzZUlkIjoiZWlnaWliLXAxLWE3LWF1dGhvcml0eS0xLjAifSwidGltZXN0YW1wUmZjMzMzOSI6IjIwMjYtMDgtMDFUMTU6NTk6NTlaIiwidGltZXN0YW1wVW5peCI6MTc4NTU5OTk5OX0KWEA4uhZr0oCXYv6uEdCHpxviJcvKRbyVuttWNyqpqrbL6S8xh5xXtKrmyfnhxub5MtfkYPes6FVGQsB2iMLKXmoH","identity":{"algorithm":"sha256","bytes":954,"digest":"3004f0f31f5a54ae6dacc0ada4ee9be7f97fa53f0eec14521dcb715ea8d8c33d"}},"expectedDecision":"rejected-not-yet-valid","id":"before-window","payload":{"data":"eyJhdXRob3JpdHlJZCI6ImVpZ2lpYi1wMS1hMTEtdHNhLTEiLCJvYnNlcnZhdGlvbklkIjoiYmVmb3JlLXdpbmRvdyIsIm9ic2VydmF0aW9uU2VxdWVuY2UiOjEwMCwicG9saWN5SWQiOiJlaWdpaWItcDEtYTExLXRpbWUtcG9saWN5LTEiLCJwb2xpY3lTZXF1ZW5jZSI6MSwicHVycG9zZSI6ImV2YWx1YXRlLXJlbGVhc2UtYXV0aG9yaXphdGlvbi12YWxpZGl0eSIsInN0YW5kYXJkIjoiRUlHSUlCLVAxLUExMS1USU1FLU9CU0VSVkFUSU9OLTEuMCIsInN1YmplY3QiOnsiYXV0aG9yaXphdGlvblJlcG9ydCI6eyJhbGdvcml0aG0iOiJzaGEyNTYiLCJieXRlcyI6MTk3OCwiZGlnZXN0IjoiMTg2MjY2MjBmYzY1ZGQ1OWRiOTU2ZjkyNmE5MThkZmYwM2RkNzdlNTMyNGY4OWQ0M2RmNTMwNDMyZWY4MDNiNyJ9LCJyZWNvdmVyZWRBdXRob3JpemF0aW9uUGF5bG9hZCI6eyJhbGdvcml0aG0iOiJzaGEyNTYiLCJieXRlcyI6NDY5LCJkaWdlc3QiOiJkMTg1MDYwODc3YWM5ZjYzY2ZiMWFlOTNmMWI1NmFlYTE2MzA3Y2UwOTA5NzdiYmMzZTk5NzAzNmFlNGE1ZDAxIn0sInJlbGVhc2VEZXNjcmlwdG9yIjp7ImFsZ29yaXRobSI6InNoYTI1NiIsImJ5dGVzIjoxMjc4LCJkaWdlc3QiOiIxNTUxMDU2ZDBiOTAzZjNmNzRiMGM0ODM0YzdkZDYwNzIwZWE2NTFmMzYwOGMyZWUzZWE5YjMwMmEyYjlmNWVjIn0sInJlbGVhc2VJZCI6ImVpZ2lpYi1wMS1hNy1hdXRob3JpdHktMS4wIn0sInRpbWVzdGFtcFJmYzMzMzkiOiIyMDI2LTA4LTAxVDE1OjU5OjU5WiIsInRpbWVzdGFtcFVuaXgiOjE3ODU1OTk5OTl9Cg==","identity":{"algorithm":"sha256","bytes":787,"digest":"00678296cc77cc9ec72615712d258d5d7b7c7d1a66c1e861a821ef4c5cecc362"}}},{"envelope":{"data":"0oRYXaMBJwN4NGFwcGxpY2F0aW9uL3ZuZC5laWdpaWIudHJ1c3RlZC10aW1lLW9ic2VydmF0aW9uK2pzb24EWCBA2njhblFqDSQYXMFnlnYAFfugiJuPu/4aSFTVZWkpMaBZAxJ7ImF1dGhvcml0eUlkIjoiZWlnaWliLXAxLWExMS10c2EtMSIsIm9ic2VydmF0aW9uSWQiOiJ2YWxpZC13aW5kb3ciLCJvYnNlcnZhdGlvblNlcXVlbmNlIjoxMDEsInBvbGljeUlkIjoiZWlnaWliLXAxLWExMS10aW1lLXBvbGljeS0xIiwicG9saWN5U2VxdWVuY2UiOjEsInB1cnBvc2UiOiJldmFsdWF0ZS1yZWxlYXNlLWF1dGhvcml6YXRpb24tdmFsaWRpdHkiLCJzdGFuZGFyZCI6IkVJR0lJQi1QMS1BMTEtVElNRS1PQlNFUlZBVElPTi0xLjAiLCJzdWJqZWN0Ijp7ImF1dGhvcml6YXRpb25SZXBvcnQiOnsiYWxnb3JpdGhtIjoic2hhMjU2IiwiYnl0ZXMiOjE5NzgsImRpZ2VzdCI6IjE4NjI2NjIwZmM2NWRkNTlkYjk1NmY5MjZhOTE4ZGZmMDNkZDc3ZTUzMjRmODlkNDNkZjUzMDQzMmVmODAzYjcifSwicmVjb3ZlcmVkQXV0aG9yaXphdGlvblBheWxvYWQiOnsiYWxnb3JpdGhtIjoic2hhMjU2IiwiYnl0ZXMiOjQ2OSwiZGlnZXN0IjoiZDE4NTA2MDg3N2FjOWY2M2NmYjFhZTkzZjFiNTZhZWExNjMwN2NlMDkwOTc3YmJjM2U5OTcwMzZhZTRhNWQwMSJ9LCJyZWxlYXNlRGVzY3JpcHRvciI6eyJhbGdvcml0aG0iOiJzaGEyNTYiLCJieXRlcyI6MTI3OCwiZGlnZXN0IjoiMTU1MTA1NmQwYjkwM2YzZjc0YjBjNDgzNGM3ZGQ2MDcyMGVhNjUxZjM2MDhjMmVlM2VhOWIzMDJhMmI5ZjVlYyJ9LCJyZWxlYXNlSWQiOiJlaWdpaWItcDEtYTctYXV0aG9yaXR5LTEuMCJ9LCJ0aW1lc3RhbXBSZmMzMzM5IjoiMjAyNi0wOC0wMVQxNzowMDowMFoiLCJ0aW1lc3RhbXBVbml4IjoxNzg1NjAzNjAwfQpYQOkz83TeyklvNwHdF03fYbafVdOLvTjVLrDusUw8p2PF/Lui1SToVPG0phu4yP5pYWNkja3ayXfBTwRdVdnKCgc=","identity":{"algorithm":"sha256","bytes":953,"digest":"f7dddf44375c81c55f6909f57c1690f824d8c163f9c549e90c6278ef0f4a6498"}},"expectedDecision":"conformant","id":"valid-window","payload":{"data":"eyJhdXRob3JpdHlJZCI6ImVpZ2lpYi1wMS1hMTEtdHNhLTEiLCJvYnNlcnZhdGlvbklkIjoidmFsaWQtd2luZG93Iiwib2JzZXJ2YXRpb25TZXF1ZW5jZSI6MTAxLCJwb2xpY3lJZCI6ImVpZ2lpYi1wMS1hMTEtdGltZS1wb2xpY3ktMSIsInBvbGljeVNlcXVlbmNlIjoxLCJwdXJwb3NlIjoiZXZhbHVhdGUtcmVsZWFzZS1hdXRob3JpemF0aW9uLXZhbGlkaXR5Iiwic3RhbmRhcmQiOiJFSUdJSUItUDEtQTExLVRJTUUtT0JTRVJWQVRJT04tMS4wIiwic3ViamVjdCI6eyJhdXRob3JpemF0aW9uUmVwb3J0Ijp7ImFsZ29yaXRobSI6InNoYTI1NiIsImJ5dGVzIjoxOTc4LCJkaWdlc3QiOiIxODYyNjYyMGZjNjVkZDU5ZGI5NTZmOTI2YTkxOGRmZjAzZGQ3N2U1MzI0Zjg5ZDQzZGY1MzA0MzJlZjgwM2I3In0sInJlY292ZXJlZEF1dGhvcml6YXRpb25QYXlsb2FkIjp7ImFsZ29yaXRobSI6InNoYTI1NiIsImJ5dGVzIjo0NjksImRpZ2VzdCI6ImQxODUwNjA4NzdhYzlmNjNjZmIxYWU5M2YxYjU2YWVhMTYzMDdjZTA5MDk3N2JiYzNlOTk3MDM2YWU0YTVkMDEifSwicmVsZWFzZURlc2NyaXB0b3IiOnsiYWxnb3JpdGhtIjoic2hhMjU2IiwiYnl0ZXMiOjEyNzgsImRpZ2VzdCI6IjE1NTEwNTZkMGI5MDNmM2Y3NGIwYzQ4MzRjN2RkNjA3MjBlYTY1MWYzNjA4YzJlZTNlYTliMzAyYTJiOWY1ZWMifSwicmVsZWFzZUlkIjoiZWlnaWliLXAxLWE3LWF1dGhvcml0eS0xLjAifSwidGltZXN0YW1wUmZjMzMzOSI6IjIwMjYtMDgtMDFUMTc6MDA6MDBaIiwidGltZXN0YW1wVW5peCI6MTc4NTYwMzYwMH0K","identity":{"algorithm":"sha256","bytes":786,"digest":"a48251eea3735f5ba4b3836052c2a139c6de0b834d6a78361fa36516e5ea0057"}}},{"envelope":{"data":"0oRYXaMBJwN4NGFwcGxpY2F0aW9uL3ZuZC5laWdpaWIudHJ1c3RlZC10aW1lLW9ic2VydmF0aW9uK2pzb24EWCBA2njhblFqDSQYXMFnlnYAFfugiJuPu/4aSFTVZWkpMaBZAxR7ImF1dGhvcml0eUlkIjoiZWlnaWliLXAxLWExMS10c2EtMSIsIm9ic2VydmF0aW9uSWQiOiJjbG9jay1yb2xsYmFjayIsIm9ic2VydmF0aW9uU2VxdWVuY2UiOjEwMiwicG9saWN5SWQiOiJlaWdpaWItcDEtYTExLXRpbWUtcG9saWN5LTEiLCJwb2xpY3lTZXF1ZW5jZSI6MSwicHVycG9zZSI6ImV2YWx1YXRlLXJlbGVhc2UtYXV0aG9yaXphdGlvbi12YWxpZGl0eSIsInN0YW5kYXJkIjoiRUlHSUlCLVAxLUExMS1USU1FLU9CU0VSVkFUSU9OLTEuMCIsInN1YmplY3QiOnsiYXV0aG9yaXphdGlvblJlcG9ydCI6eyJhbGdvcml0aG0iOiJzaGEyNTYiLCJieXRlcyI6MTk3OCwiZGlnZXN0IjoiMTg2MjY2MjBmYzY1ZGQ1OWRiOTU2ZjkyNmE5MThkZmYwM2RkNzdlNTMyNGY4OWQ0M2RmNTMwNDMyZWY4MDNiNyJ9LCJyZWNvdmVyZWRBdXRob3JpemF0aW9uUGF5bG9hZCI6eyJhbGdvcml0aG0iOiJzaGEyNTYiLCJieXRlcyI6NDY5LCJkaWdlc3QiOiJkMTg1MDYwODc3YWM5ZjYzY2ZiMWFlOTNmMWI1NmFlYTE2MzA3Y2UwOTA5NzdiYmMzZTk5NzAzNmFlNGE1ZDAxIn0sInJlbGVhc2VEZXNjcmlwdG9yIjp7ImFsZ29yaXRobSI6InNoYTI1NiIsImJ5dGVzIjoxMjc4LCJkaWdlc3QiOiIxNTUxMDU2ZDBiOTAzZjNmNzRiMGM0ODM0YzdkZDYwNzIwZWE2NTFmMzYwOGMyZWUzZWE5YjMwMmEyYjlmNWVjIn0sInJlbGVhc2VJZCI6ImVpZ2lpYi1wMS1hNy1hdXRob3JpdHktMS4wIn0sInRpbWVzdGFtcFJmYzMzMzkiOiIyMDI2LTA4LTAxVDE2OjMwOjAwWiIsInRpbWVzdGFtcFVuaXgiOjE3ODU2MDE4MDB9ClhAOn0oUfe0v/SJ5MH1YFp6p+KOk1CayFVDB+1JBNJDvgWcadq6d8xEaQ8X2mcMQ+Y1cAEBtrarFUivisGH/EhiAQ==","identity":{"algorithm":"sha256","bytes":955,"digest":"bfbfd2f528972f47806a6aef60324f9f18439c21c2dd7215210197c6b2d36a6f"}},"expectedDecision":"rejected-clock-rollback","id":"clock-rollback","payload":{"data":"eyJhdXRob3JpdHlJZCI6ImVpZ2lpYi1wMS1hMTEtdHNhLTEiLCJvYnNlcnZhdGlvbklkIjoiY2xvY2stcm9sbGJhY2siLCJvYnNlcnZhdGlvblNlcXVlbmNlIjoxMDIsInBvbGljeUlkIjoiZWlnaWliLXAxLWExMS10aW1lLXBvbGljeS0xIiwicG9saWN5U2VxdWVuY2UiOjEsInB1cnBvc2UiOiJldmFsdWF0ZS1yZWxlYXNlLWF1dGhvcml6YXRpb24tdmFsaWRpdHkiLCJzdGFuZGFyZCI6IkVJR0lJQi1QMS1BMTEtVElNRS1PQlNFUlZBVElPTi0xLjAiLCJzdWJqZWN0Ijp7ImF1dGhvcml6YXRpb25SZXBvcnQiOnsiYWxnb3JpdGhtIjoic2hhMjU2IiwiYnl0ZXMiOjE5NzgsImRpZ2VzdCI6IjE4NjI2NjIwZmM2NWRkNTlkYjk1NmY5MjZhOTE4ZGZmMDNkZDc3ZTUzMjRmODlkNDNkZjUzMDQzMmVmODAzYjcifSwicmVjb3ZlcmVkQXV0aG9yaXphdGlvblBheWxvYWQiOnsiYWxnb3JpdGhtIjoic2hhMjU2IiwiYnl0ZXMiOjQ2OSwiZGlnZXN0IjoiZDE4NTA2MDg3N2FjOWY2M2NmYjFhZTkzZjFiNTZhZWExNjMwN2NlMDkwOTc3YmJjM2U5OTcwMzZhZTRhNWQwMSJ9LCJyZWxlYXNlRGVzY3JpcHRvciI6eyJhbGdvcml0aG0iOiJzaGEyNTYiLCJieXRlcyI6MTI3OCwiZGlnZXN0IjoiMTU1MTA1NmQwYjkwM2YzZjc0YjBjNDgzNGM3ZGQ2MDcyMGVhNjUxZjM2MDhjMmVlM2VhOWIzMDJhMmI5ZjVlYyJ9LCJyZWxlYXNlSWQiOiJlaWdpaWItcDEtYTctYXV0aG9yaXR5LTEuMCJ9LCJ0aW1lc3RhbXBSZmMzMzM5IjoiMjAyNi0wOC0wMVQxNjozMDowMFoiLCJ0aW1lc3RhbXBVbml4IjoxNzg1NjAxODAwfQo=","identity":{"algorithm":"sha256","bytes":788,"digest":"cc15361bd5f00066417ceada8e51880e76f8e8434adda112c29e2062e2d7cf48"}}},{"envelope":{"data":"0oRYXaMBJwN4NGFwcGxpY2F0aW9uL3ZuZC5laWdpaWIudHJ1c3RlZC10aW1lLW9ic2VydmF0aW9uK2pzb24EWCBA2njhblFqDSQYXMFnlnYAFfugiJuPu/4aSFTVZWkpMaBZAxR7ImF1dGhvcml0eUlkIjoiZWlnaWliLXAxLWExMS10c2EtMSIsIm9ic2VydmF0aW9uSWQiOiJleHBpcmVkLXdpbmRvdyIsIm9ic2VydmF0aW9uU2VxdWVuY2UiOjEwMywicG9saWN5SWQiOiJlaWdpaWItcDEtYTExLXRpbWUtcG9saWN5LTEiLCJwb2xpY3lTZXF1ZW5jZSI6MSwicHVycG9zZSI6ImV2YWx1YXRlLXJlbGVhc2UtYXV0aG9yaXphdGlvbi12YWxpZGl0eSIsInN0YW5kYXJkIjoiRUlHSUlCLVAxLUExMS1USU1FLU9CU0VSVkFUSU9OLTEuMCIsInN1YmplY3QiOnsiYXV0aG9yaXphdGlvblJlcG9ydCI6eyJhbGdvcml0aG0iOiJzaGEyNTYiLCJieXRlcyI6MTk3OCwiZGlnZXN0IjoiMTg2MjY2MjBmYzY1ZGQ1OWRiOTU2ZjkyNmE5MThkZmYwM2RkNzdlNTMyNGY4OWQ0M2RmNTMwNDMyZWY4MDNiNyJ9LCJyZWNvdmVyZWRBdXRob3JpemF0aW9uUGF5bG9hZCI6eyJhbGdvcml0aG0iOiJzaGEyNTYiLCJieXRlcyI6NDY5LCJkaWdlc3QiOiJkMTg1MDYwODc3YWM5ZjYzY2ZiMWFlOTNmMWI1NmFlYTE2MzA3Y2UwOTA5NzdiYmMzZTk5NzAzNmFlNGE1ZDAxIn0sInJlbGVhc2VEZXNjcmlwdG9yIjp7ImFsZ29yaXRobSI6InNoYTI1NiIsImJ5dGVzIjoxMjc4LCJkaWdlc3QiOiIxNTUxMDU2ZDBiOTAzZjNmNzRiMGM0ODM0YzdkZDYwNzIwZWE2NTFmMzYwOGMyZWUzZWE5YjMwMmEyYjlmNWVjIn0sInJlbGVhc2VJZCI6ImVpZ2lpYi1wMS1hNy1hdXRob3JpdHktMS4wIn0sInRpbWVzdGFtcFJmYzMzMzkiOiIyMDI2LTA4LTAyVDE2OjAwOjAxWiIsInRpbWVzdGFtcFVuaXgiOjE3ODU2ODY0MDF9ClhA2CXDUwRK6hDYQImNmCDr02Ajmrt6il4q9CJ0tXi48V3noePp/X4KlNPsNlkGgmIfG0ftY1fQRD8BkmDH9yDYAA==","identity":{"algorithm":"sha256","bytes":955,"digest":"3aea9970b4773308d69bb8a36edc91f641127b4a8c2ebaf028647525c8c2f237"}},"expectedDecision":"rejected-expired","id":"expired-window","payl